{
  "$schema": "https://json-schema.org/draft/2020-12/schema",
  "$id": "openshiksha:content-pack/v1",
  "title": "OpenShiksha content pack",
  "description": "A versioned, self-describing bundle of question-bank content authored by an external contributor. Validated by construction (CP-1) before it is ever staged (CP-2) or approved into the shared bank (CP-3). Taxonomy references (standard/subject/chapter) are carried as human-readable identifiers here; the importer resolves them to FKs at stage time.",
  "type": "object",
  "additionalProperties": false,
  "required": ["pack_version", "provenance", "questions"],
  "properties": {
    "pack_version": {
      "description": "Content-pack schema version. Only \"1.0\" exists today; a mismatch is a hard reject so an older importer never silently mis-reads a newer pack.",
      "const": "1.0"
    },
    "name": {
      "type": "string",
      "minLength": 1,
      "maxLength": 200,
      "description": "Optional human label for the pack (shown in the review queue)."
    },
    "provenance": {
      "$ref": "#/$defs/provenance"
    },
    "questions": {
      "type": "array",
      "minItems": 1,
      "description": "The questions this pack contributes. Never empty — an empty pack is a mistake, not a no-op.",
      "items": { "$ref": "#/$defs/question" }
    }
  },
  "$defs": {
    "provenance": {
      "type": "object",
      "additionalProperties": false,
      "required": ["author", "license"],
      "description": "Honest attribution block. author + license are mandatory so approved content always lands with a credit and a usage grant.",
      "properties": {
        "author": {
          "type": "string",
          "minLength": 1,
          "maxLength": 200,
          "description": "Who authored the pack (person or organisation)."
        },
        "license": {
          "type": "string",
          "minLength": 1,
          "maxLength": 100,
          "description": "The license the content is offered under (e.g. \"CC-BY-4.0\")."
        },
        "source": {
          "type": "string",
          "maxLength": 2000,
          "description": "Optional URL or citation for where the content came from."
        },
        "contact": {
          "type": "string",
          "maxLength": 200,
          "description": "Optional contact (email / handle) for the contributor."
        }
      }
    },
    "question": {
      "type": "object",
      "additionalProperties": false,
      "required": ["standard", "subject", "chapter", "subparts"],
      "properties": {
        "standard": {
          "type": "integer",
          "minimum": 1,
          "maximum": 12,
          "description": "Grade/standard number (1..12)."
        },
        "subject": {
          "type": "string",
          "minLength": 1,
          "maxLength": 100,
          "description": "Subject name, resolved to a Subject FK at import."
        },
        "chapter": {
          "type": "string",
          "minLength": 1,
          "maxLength": 200,
          "description": "Chapter name, resolved to a Chapter FK at import."
        },
        "question_type": {
          "description": "Answer type for the question. Defaults to \"mcq\" at import if omitted.",
          "enum": ["mcq", "fill_blank", "matching", "multi_select", "numeric", "short_answer", "compound"]
        },
        "difficulty": {
          "type": "integer",
          "minimum": 1,
          "maximum": 5,
          "description": "1=easiest .. 5=hardest. Defaults to 2 at import if omitted."
        },
        "stem_text": {
          "type": "string",
          "maxLength": 20000,
          "description": "Optional shared stem rendered once above the subpart list."
        },
        "tags": {
          "type": "array",
          "items": { "type": "string", "minLength": 1, "maxLength": 100 },
          "description": "Optional free-text tags; matched/created at import."
        },
        "subparts": {
          "type": "array",
          "minItems": 1,
          "items": { "$ref": "#/$defs/subpart" }
        }
      }
    },
    "subpart": {
      "type": "object",
      "additionalProperties": false,
      "required": ["index", "question_text"],
      "properties": {
        "index": {
          "type": "integer",
          "minimum": 0,
          "description": "0-indexed order within the question."
        },
        "subpart_type": {
          "description": "Per-subpart answer type; blank falls back to the parent question_type.",
          "enum": ["mcq", "fill_blank", "matching", "multi_select", "numeric", "short_answer", ""]
        },
        "question_text": {
          "type": "string",
          "minLength": 1,
          "maxLength": 20000,
          "description": "Prompt (LaTeX or plain text). Never blank."
        },
        "options": {
          "type": ["array", "null"],
          "description": "MCQ choices; null for non-MCQ types.",
          "items": {
            "type": "object",
            "additionalProperties": false,
            "required": ["key", "text"],
            "properties": {
              "key": { "type": "string", "minLength": 1 },
              "text": { "type": "string" }
            }
          }
        },
        "correct_answer": {
          "type": "object",
          "description": "Answer data, e.g. {\"type\": \"mcq\", \"answer\": 2}."
        },
        "variable_constraints": {
          "type": ["object", "null"],
          "description": "Croupier variable definitions for {{token}} substitution."
        },
        "image_url": {
          "type": "string",
          "maxLength": 2000,
          "description": "Optional image URL shown above the prompt."
        },
        "solution_text": { "type": "string", "maxLength": 20000 },
        "hint_text": { "type": "string", "maxLength": 20000 },
        "widget_kind": {
          "type": "string",
          "maxLength": 64,
          "description": "Registry key of an interactive widget, or blank. Validated against the vendored per-kind widget schema in addition to this schema."
        },
        "widget_config": {
          "type": "object",
          "description": "Per-widget config; validated against the kind's params schema via validate_widget_config."
        }
      }
    }
  }
}
