{
  "pack_version": "1.0",
  "name": "Fractions starter pack (example)",
  "provenance": {
    "author": "OpenShiksha Community Docs",
    "license": "CC-BY-4.0",
    "source": "https://github.com/openshiksha/openshiksha/tree/qa/contrib/packs",
    "contact": "hello@openshiksha.org"
  },
  "questions": [
    {
      "standard": 5,
      "subject": "Mathematics",
      "chapter": "Fractions",
      "question_type": "mcq",
      "difficulty": 2,
      "tags": ["fractions", "halves"],
      "subparts": [
        {
          "index": 0,
          "subpart_type": "mcq",
          "question_text": "Which of these is equal to one half?",
          "options": [
            { "key": "A", "text": "2/4" },
            { "key": "B", "text": "1/3" },
            { "key": "C", "text": "3/4" }
          ],
          "correct_answer": { "type": "mcq", "answer": "A" },
          "solution_text": "2/4 simplifies to 1/2: divide the numerator and denominator by 2.",
          "hint_text": "Try simplifying each fraction to its lowest terms."
        }
      ]
    },
    {
      "standard": 5,
      "subject": "Mathematics",
      "chapter": "Fractions",
      "question_type": "numeric",
      "difficulty": 2,
      "stem_text": "Use the number line below to answer.",
      "subparts": [
        {
          "index": 0,
          "subpart_type": "numeric",
          "question_text": "Mark one half on the number line.",
          "options": null,
          "correct_answer": { "type": "numeric", "answer": 0.5 },
          "widget_kind": "number-line",
          "widget_config": {
            "min": 0,
            "max": 1,
            "step": 0.5,
            "label": "Position on the number line"
          }
        }
      ]
    }
  ]
}
